Code,Name
FAAIX,Fidelity Advisor Asset Manager 70% Class
FAASX,Fidelity Advisor Asset Manager 70% Class
FABCX,Fidelity Advisor Series II Fidelity
FABLX,Fidelity Advisor Series II Fidelity
FACDX,Fidelity Advisor Series Vii Fidelity
FACFX,Fidelity Advisor Freedom 2010 Cl A
FACGX,Fidelity Advisor Series II Fidelity
FACIX,Fidelity Advisor Municipal Income 2019
FACNX,Fidelity Advisor Canada Fund Class A
FACPX,Fidelity Advisor Consumer Discretionary
FACTX,Fidelity Advisor Series Vii Fidelity
FACVX,Fidelity Advisor Convertible Securities
FADAX,Fidelity Advisor Series I Fidelity
FADCX,Fidelity Advisor Series ViII Fidelity
FADIX,Fidelity Advisor Series ViII Fidelity
FADTX,Fidelity Advisor Series Vii Fidelity
FAEGX,Fidelity Advisor Equity Growth Fund T
FAEMX,Fidelity Advisor Emerging Markets Income
FAERX,Fidelity Advisor Overseas Fund T Shares
FAFAX,Fidelity Advisor Freedom Income Class A
FAFCX,Fidelity Advisor Series Vii Fidelity
FAFDX,Fidelity Advisor Series Vii Fidelity
FAFEX,Fidelity Advisor Freedom 2030 Cl A
FAFFX,Fidelity Advisor Freedom 2040 Cl A
FAFSX,Fidelity Advisor Series Vii Fidelity
FAGAX,Fidelity Advisor Series II Fidelity
FAGCX,Fidelity Advisor Growth Opportunities
FAGIX,Fidelity Capital and Income Fund
FAGKX,Fidelity Growth Strategies Fund Class K
FAGNX,Fidelity Advisor Energy Class T
FAGOX,Fidelity Advisor Growth Opportunities
FAHCX,Fidelity Advisor High Income Advantage
FAHDX,Fidelity Advisor High Income Advantage
FAHEX,Fidelity Advisor High Income Advantage
FAHIX,Fidelity Advisor Municipal Income Fund
FAHYX,Fidelity Advisor High Income Advantage
FAIDX,Fidelity Advisor International Discovery
FAIGX,Fidelity Advisor Balanced Fd T Shares
FAIOX,Fidelity Advisor Balanced Fund Class I
FAIVX,Fidelity Advisor Equity Value Fund Class
FALAX,Fidelity Advisor Series I Fidelity
FALGX,Fidelity Advisor Series I Fidelity
FALIX,Fidelity Advisor Large Cap Fund Class I
FAMCX,Fidelity Advisor Series II Fidelity
FAMGX,Fidelity Advisor Series Opportunistic
FAMKX,Fidelity Advisor Emerging Markets Class
FAMMX,Fidelity Advisor Municipal Income 2017
FAMRX,Fidelity Asset Manager 85%
FAMUX,Fidelity Advisor Series II Fidelity
FANAX,Fidelity Advisor Energy Class A
FANCX,Fidelity Advisor Short-Term Bond Fund
FANIX,Fidelity Advisor Energy Fund Class I
FAOAX,Fidelity Advisor Series Vii Fidelity
FAOCX,Fidelity Advisor Ser Vii Fidelity
FAOFX,Fidelity Advisor Series Growth
FAOIX,Fidelity Advisor Overseas Fund Class I
FAPAX,Fidelity Advisor Municipal Income 2019
FARFX,Fidelity Advisor Income Replacement 2042
FARNX,Fidelity Event Driven Opportunities Fund
FARPX,Fidelity Advisor Income Replacement Fund
FARSX,Fidelity Advisor Income Replacement Fund
FARVX,Fidelity Advisor Income Replacement 2038
FARWX,Fidelity Advisor Income Replacement 2040
FASDX,Fidelity Advisor Strategic Dividend &
FASGX,Fidelity Asset Manager 70%
FASHX,Fidelity Advisor Limited Term Municipal
FASIX,Fidelity Asset Manager 20%
FASMX,Fidelity Asset Manager 50%
FASOX,Fidelity Advisor Value Strategies Fund
FASPX,Fidelity Advisor Value Strategies Fund
FATEX,Fidelity Advisor Series Vii Fidelity
FATHX,Fidelity Advisor Freedom 2035 Cl A
FATIX,Fidelity Advisor Technology Fund Class I
FATJX,Fidelity Advisor Event Driven
FATWX,Fidelity Advisor Freedom 2025 Cl A
FAUFX,Fidelity Advisor Utilities Cl T
FAVAX,Fidelity Advisor Equity Value Cl A
FAVCX,Fidelity Advisor Equity Value Cl C
FAVFX,Fidelity Advisor Value Class A
FAVIX,Fidelity Advisor Municipal Income 2017
FAVTX,Fidelity Advisor Equity Value Class T
FAYZX,Fidelity Advisor Multi-Asset Income Fund
FAZYX,Fidelity Advisor Multi-Asset Income Fund
FBAKX,Fidelity Balanced Fund Class K
FBALX,Fidelity Balanced Fund
FBCVX,Fidelity Blue Chip Value
FBGKX,Fidelity Blue Chip Growth Fund Class K
FBGRX,Fidelity Blue Chip Growth Fund
FBIFX,Fidelity Freedom Index 2040 Fd Cl K
FBIOX,Fidelity Select Biotechnology Pt
FBKWX,Fidelity Advisor Total Bond Fund Class Z
FBLEX,Fidelity Series Stock Selector Large Cap
FBLTX,Fidelity Sai Long-Term Treasury Bond
FBLYX,Fidelity Advisor Global Equity Income Fd
FBMAX,Fidelity Series Broad Market
FBMPX,Fidelity Select Multimedia Portfolio
FBNAX,Fidelity Advisor Short-Term Bond Fund
FBNDX,Fidelity Investment Grade Bond Fund
FBNIX,Fidelity Advisor Short-Term Bond Fund
FBNTX,Fidelity Advisor Short-Term Bond Fund
FBRNX,Fidelity Advisor Stock Selector All Cap
FBSOX,Fidelity Select IT Services
FBTAX,Fidelity Advisor Biotechnology Cl A
FBTCX,Fidelity Advisor Biotechnology Cl C
FBTIX,Fidelity Advisor Biotechnology Fund
FBTTX,Fidelity Advisor Biotechnology Cl T
FBUSX,Fidelity Advisor Global Equity Income
FCADX,Fidelity Advisor International Discovery
FCAFX,Fidelity Advisor Freedom Income Cl C
FCAGX,Fidelity Advisor Small Cap Growth Fd Cl
FCAKX,Fidelity Capital Appreciation Fund Class
FCANX,Fidelity Advisor Asset Manager 30% Class
FCASX,Fidelity Advisor Asset Manager 70% Class
FCBAX,Fidelity Advisor Corporate Bond Fund
FCBFX,Fidelity Corporate Bond Fund
FCBIX,Fidelity Advisor Corporate Bond Fund
FCBTX,Fidelity Advisor Corporate Bond Fund
FCCCX,Fidelity Advisor Corporate Bond Fund
FCCGX,Fidelity Advisor Small Cap Growth Fd Cl
FCCNX,Fidelity Advisor Canada Fund Class C
FCCVX,Fidelity Advisor Convertible Securities
FCDAX,Fidelity Advisor Stock Selector Small
FCDCX,Fidelity Advisor Stock Selector Small
FCDIX,Fidelity Advisor Stock Selector Small
FCDTX,Fidelity Advisor Stock Selector Small
FCECX,Fidelity Advisor Consumer Discretionary
FCEPX,Fidelity Advisor Total Bond Fund Class C
FCFCX,Fidelity Advisor Freedom 2010 Cl C
FCFEX,Fidelity Advisor Freedom 2030 Cl C
FCFFX,Fidelity Advisor Freedom 2040 Cl C
FCFTX,Fidelity Advisor Freedom 2010 Cl T
FCFVX,Fidelity Advisor Freedom 2005 Cl C
FCGCX,Fidelity Advisor Global Commodity Stock
FCGSX,Fidelity Series Growth Company Fund
FCHKX,Fidelity Advisor China Region Fund Class
FCHPX,Fidelity Municipal Income 2023 Fund
FCHSX,Fidelity Advisor Event Driven
FCIFX,Fidelity Advisor Freedom 2010 Fund Class
FCIGX,Fidelity Advisor Small Cap Growth Fund
FCLAX,Fidelity Advisor Industrials Cl A
FCLCX,Fidelity Advisor Industrials Cl C
FCLIX,Fidelity Advisor Industrials Fund Class
FCLTX,Fidelity Advisor Industrials Cl T
FCMAX,Fidelity Advisor California Municipal
FCMKX,Fidelity Advisor California Municipal
FCMQX,Fidelity Advisor California Municipal
FCMTX,Fidelity Advisor California Municipal
FCNAX,Fidelity Advisor Consumer Discretionary
FCNIX,Fidelity Advisor Consumer Discretionary
FCNKX,Fidelity Contra Fund Class K
FCNTX,Fidelity Contra Fund
FCNVX,Fidelity Conservative Income Bond Fd
FCONX,Fidelity Conservative Income Bond Fd
FCPAX,Fidelity Advisor Series Vii
FCPCX,Fidelity Advisor Series ViII Fidelity
FCPEX,Fidelity Small Cap Enhanced Index Fund
FCPGX,Fidelity Small Cap Growth Fund
FCPIX,Fidelity Advisor International Capital
FCPVX,Fidelity Small Cap Value Fund
FCRDX,Fidelity Conservative Income Municipal
FCRFX,Fidelity Advisor Income Replacement 2042
FCRPX,Fidelity Advisor Income Replacement Fund
FCRSX,Fidelity Advisor Income Replacement Fund
FCRVX,Fidelity Advisor Income Replacement 2038
FCRWX,Fidelity Advisor Income Replacement 2040
FCSDX,Fidelity Advisor Strategic Dividend &
FCSFX,Fidelity Series Commodity Strategy Fd Cl
FCSHX,Fidelity Advisor Limited Term Municipal
FCSRX,Fidelity Advisor Strategic Real Return
FCSSX,Fidelity Series Commodity Strategy Fd
FCSTX,Fidelity California Limited Term
FCTFX,Fidelity California Municipal Income
FCTGX,Fidelity Advisor Small Cap Growth Fd Cl
FCTHX,Fidelity Advisor Freedom 2035 Cl C
FCTWX,Fidelity Advisor Freedom 2025 Cl C
FCVAX,Fidelity Advisor Small Cap Value Fd Cl A
FCVCX,Fidelity Advisor Small Cap Value Fd Cl C
FCVFX,Fidelity Advisor Value Class C
FCVIX,Fidelity Advisor Small Cap Value Fund
FCVSX,Fidelity Convertible Securities Fund
FCVTX,Fidelity Advisor Small Cap Value Fd Cl T
FCYIX,Fidelity Select Industrials
FDAFX,Fidelity Advisor Freedom 2020 Cl A
FDAGX,Fidelity Advisor Consumer Staples Fund
FDASX,Fidelity Advisor Global Strategies Fund
FDCAX,Fidelity Capital Trust Capital
FDCFX,Fidelity Advisor Freedom 2020 Cl C
FDCGX,Fidelity Advisor Consumer Staples Fund
FDCPX,Fidelity Select Computer Pt
FDCSX,Fidelity Advisor Global Strategies Fund
FDECX,Fidelity Advisor Capital Development
FDEEX,Fidelity Freedom 2055 Fund
FDEGX,Fidelity Growth Strategies Fund
FDEIX,Fidelity Advisor Capital Development
FDEKX,Fidelity Disciplined Equity Fund Class K
FDENX,Fidelity Freedome K 2055 Fund
FDEQX,Fidelity Disciplined Equity Fund
FDESX,Fidelity Advisor Diversified Stock Fund
FDETX,Fidelity Advisor Capital Development
FDEWX,Fidelity Freedom Index 2055 Fd Cl W
FDFAX,Fidelity Select Consumer Staples
FDFFX,Fidelity Independence Fund
FDFKX,Fidelity Independence Fund Class K
FDGCX,Fidelity Advisor Series I Fidelity
FDGFX,Fidelity Dividend Growth Fund
FDGIX,Fidelity Advisor Dividend Growth Fund
FDGKX,Fidelity Dividend Growth Fund Class K
FDGRX,Fidelity Growth Co Fund
FDGTX,Fidelity Advisor Series I Fidelity
FDIAX,Fidelity Advisor Limited Term Bond Fund
FDIFX,Fidelity Advisor Freedom 2020 Fund Class
FDIGX,Fidelity Advisor Consumer Staples Fund
FDIKX,Fidelity Diversified International Fund
FDIVX,Fidelity Diversified International Fund
FDKLX,Fidelity Freedom Index 2060 Fund - Class
FDKNX,Fidelity Freedom K 2060 Fund
FDKPX,Fidelity Advisor Freedom 2060 Fund
FDKQX,Fidelity Advisor Freedom 2060 Fund Class
FDKSX,Fidelity Advisor Freedom 2060 Fund
FDKTX,Fidelity Advisor Freedom 2060 Fund
FDKVX,Fidelity Freedom 2060 Fund
FDLSX,Fidelity Select Leisure & Entertainment
FDMAX,Fidelity Advisor Communications
FDMCX,Fidelity Advisor Communications
FDMIX,Fidelity Advisor Communications
FDMLX,Fidelity Series Intrinsic Opportunities
FDMMX,Fidelity Massachuseets Municipal Income
FDMTX,Fidelity Advisor Communications
FDSCX,Fidelity Stock Selector Small Cap Fund
FDSSX,Fidelity Stock Selector All Cap Fund
FDSVX,Fidelity Growth Discovery Fund
FDTCX,Fidelity Advisor Diversified Stock Fund
FDTEX,Fidelity Advisor Diversified Stock Fund
FDTFX,Fidelity Advisor Freedom 2020 Cl T
FDTGX,Fidelity Advisor Consumer Staples Fund
FDTIX,Fidelity Advisor Diversified Stock Fund
FDTOX,Fidelity Advisor Diversified Stock Fund
FDTSX,Fidelity Advisor Global Strategies Fund
FDTTX,Fidelity Advisor Capital Development
FDTZX,Fidelity Advisor Capital Development
FDVAX,Fidelity Advisor Series ViII Fidelity
FDVIX,Fidelity Advisor Diversified
FDVLX,Fidelity Value Fund
FDYIX,Fidelity Advisor Global Strategies Fund
FDYSX,Fidelity Global Strategies Fund
FEAAX,Fidelity Advisor Series ViII Fidelity
FEATX,Fidelity Advisor Series ViII Fidelity
FEDAX,Fidelity Advisor Emerging Markets
FEDCX,Fidelity Series Emerging Markets Debt Fd
FEDDX,Fidelity Emerging Markets Discovery Fd
FEDFX,Fidelity Series Emerging Markets Debt Fd
FEDGX,Fidelity Advisor Emerging Markets
FEDIX,Fidelity Advisor Emerging Markets
FEDTX,Fidelity Advisor Emerging Markets
FEFIX,Fidelity Advisor Freedom 2030 Fund Class
FEIAX,Fidelity Advisor Series III Fidelity
FEICX,Fidelity Advisor Series III Fidelity
FEIKX,Fidelity Equity Income Fund Class K
FEIRX,Fidelity Advisor Equity Income Fund T
FELAX,Fidelity Advisor Electronics Cl A
FELCX,Fidelity Advisor Electronics Cl C
FELIX,Fidelity Advisor Electronics Fund Class
FELTX,Fidelity Advisor Electronics Cl T
FEMCX,Fidelity Advisor Emerging Europe Middle
FEMEX,Fidelity Advisor Emerging Europe Middle
FEMFX,Fidelity Series Emerging Markets Fund Cl
FEMIX,Fidelity Advisor New York Municipal
FEMKX,Fidelity Emerging Markets Fund
FEMSX,Fidelity Series Emerging Markets Fund
FEMTX,Fidelity Advisor Emerging Europe Middle
FEPAX,Fidelity Advisor Total Bond Fund Class A
FEPIX,Fidelity Advisor Total Bond Fund Class I
FEPTX,Fidelity Advisor Total Bond Fund Class T
FEQIX,Fidelity Equity Income Fund
FEQTX,Fidelity Equity Dividend Income Fd
FERCX,Fidelity Advisor Emerging Asia Cl C
FERGX,Fidelity Sai Emerging Markets Index Fund
FERIX,Fidelity Advisor Emerging Asia Fund
FESIX,Fidelity Sai Real Estate Index Fund
FETKX,Fidelity Equity Dividend Income Fd Cl K
FEUCX,Fidelity Advisor Global Equity Cl C
FEUIX,Fidelity Advisor Global Capital
FEXKX,Fidelity Export & Multinational Fund
FEXPX,Fidelity Export and Multinational Fund
FEYAX,Fidelity Advisor Asset Manager 85% Class
FEYCX,Fidelity Advisor Asset Manager 85% Class
FEYIX,Fidelity Advisor Asset Manager 85% Class
FEYTX,Fidelity Advisor Asset Manager 85% Class
FFAMX,Fidelity Advisor Asset Manager 50% Class
FFANX,Fidelity Asset Manager 40%
FFAVX,Fidelity Advisor Freedom 2005 Cl A
FFCMX,Fidelity Advisor Asset Manager 50% Class
FFDKX,Fidelity Fund Class K
FFEDX,Fidelity Freedom Index 2025 Fund Class W
FFEGX,Fidelity Freedom Index 2030 Fund Class W
FFEZX,Fidelity Freedom Index 2035 Fund Class W
FFFAX,Fidelity Freedom Income Fund
FFFCX,Fidelity Freedom 2010 Fund
FFFDX,Fidelity Freedom 2020 Fund
FFFEX,Fidelity Freedom 2030 Fund
FFFFX,Fidelity Freedom 2040
FFFGX,Fidelity Freedom 2045 Fund
FFFHX,Fidelity Freedom 2050 Fund
FFFIX,Fidelity Advisor Freedom 2045 Fund Class
FFFJX,Fidelity Advisor Freedom 2045 Fund Class
FFFLX,Fidelity Advisor Freedom 2050 Fund Class
FFFPX,Fidelity Advisor Freedom 2050 Fund Class
FFFQX,Fidelity Advisor Freedom 2050 Fund Class
FFFTX,Fidelity Advisor Freedom 2045 Fund Class
FFFVX,Fidelity Freedom 2005
FFFYX,Fidelity Advisor Freedom 2050 Fund Class
FFFZX,Fidelity Advisor Freedom 2045 Fund Class
FFGAX,Fidelity Advisor Global Commodity Stock
FFGCX,Fidelity Global Commodity Stock Fund
FFGFX,Fidelity Freedom Index 2005 Fund Class W
FFGIX,Fidelity Advisor Global Commodity Stock
FFGSX,Fidelity Series Growth Company Fund
FFGTX,Fidelity Advisor Global Commodity Stock
FFGZX,Fidelity Freedom Index Income Fund Class
FFHCX,Fidelity Series Floating Rate High
FFHFX,Fidelity Series Floting Rate High Income
FFIDX,Fidelity Fund
FFIGX,Fidelity Series International Growth
FFIMX,Fidelity Advisor Asset Manager 50% Class
FFIPX,Fidelity Series Inflation-Protected Bond
FFIVX,Fidelity Advisor Freedom 2005 Fund Class
FFIZX,Fidelity Freedom Index 2040 Fund Class W
FFKAX,Fidelity Freedom K Income Fund
FFKCX,Fidelity Freedom K 2010 Fund
FFKDX,Fidelity Freedom K 2020 Fund
FFKEX,Fidelity Freedom K 2030 Fund
FFKFX,Fidelity Freedom K 2040 Fund
FFKGX,Fidelity Freedom K 2045 Fund
FFKHX,Fidelity Freedom K 2050 Fund
FFKVX,Fidelity Freedom K 2005 Fund
FFLDX,Fidelity Freedom Index 2055 Fund Class W
FFLEX,Fidelity Freedom Index 2060 Fund Class W
FFNAX,Fidelity Advisor Asset Manager 40% Class
FFNCX,Fidelity Advisor Asset Manager 40% Class
FFNIX,Fidelity Advisor Asset Manager 40% Class
FFNOX,Fidelity Oxford Street Trust Fidelity
FFNTX,Fidelity Advisor Asset Manager 40% Class
FFOLX,Fidelity Freedom Index 2045 Fund Class W
FFOPX,Fidelity Freedom Index 2050 Fund Class W
FFRAX,Fidelity Advisor Floating Rate High
FFRCX,Fidelity Advisor Floating Rate High
FFRHX,Fidelity Floating Rate High Income
FFRIX,Fidelity Advisor Floating Rate High
FFRTX,Fidelity Advisor Floating Rate High
FFSIX,Fidelity Advisor Financial Services Fund
FFSMX,Fidelity Spartan Total Market Index Fd
FFSTX,Fidelity Series International Small Cap
FFTHX,Fidelity Freedom 2035
FFTMX,Fidelity Advisor Asset Manager 50% Class
FFTTX,Fidelity Series Long-Term Treas
FFTVX,Fidelity Advisor Freedom 2005 Cl T
FFTWX,Fidelity Freedom 2025
FFVAX,Fidelity Advisor Freedom 2015 Cl A
FFVCX,Fidelity Advisor Freedom 2015 Cl C
FFVFX,Fidelity Freedom 2015
FFVIX,Fidelity Advisor Freedom 2015 Fund Class
FFVNX,Fidelity Series International Value Fund
FFVTX,Fidelity Advisor Freedom 2015 Cl T
FFWTX,Fidelity Freedom Index 2010 Fund Class W
FFXSX,Fidelity Limited Term Government Fund
FGABX,Fidelity Advisor Global Equity Income Fd
FGBAX,Fidelity Advisor Investment Grade Bond
FGBCX,Fidelity Advisor Investment Grade Bond
FGBFX,Fidelity Global Bond Fund Retail Class
FGBIX,Fidelity Advisor Global Bond Fund -
FGBLX,Fidelity Global Balanced Fund
FGBPX,Fidelity Advisor Investment Grade Bond
FGBTX,Fidelity Advisor Investment Grade Bond
FGBWX,Fidelity Advisor Global Bond Fund Class
FGBYX,Fidelity Advisor Global Bond Fund Class
FGBZX,Fidelity Advisor Global Bond Fund Class
FGCKX,Fidelity Growth Company Fund Class K
FGDAX,Fidelity Advisor Gold Fund Class A
FGDCX,Fidelity Advisor Gold Fund Class C
FGDIX,Fidelity Advisor Gold Fund Class I
FGDKX,Fidelity Growth Discovery Fund Class K
FGDTX,Fidelity Advisor Gold Fund Class T
FGEAX,Fidelity Advisor Global Equity Cl A
FGETX,Fidelity Advisor Global Equity Cl T
FGHAX,Fidelity Advisor Global High Income Fd
FGHCX,Fidelity Advisor Global High Income Fd
FGHIX,Fidelity Advisor Global High Income Fund
FGHNX,Fidelity Global High Income Fd
FGHTX,Fidelity Advisor Global High Income Fd
FGIKX,Fidelity Growth & Income Portfolio Class
FGILX,Fidelity Global Equity Income Fd
FGIOX,Fidelity Advisor Growth & Income Fund
FGIRX,Fidelity Advisor Series I Fidelity
FGITX,Fidelity Advisor Series I Fidelity
FGIUX,Fidelity Advisor Series I Fidelity
FGLAX,Fidelity Advisor Global Balanced Fund
FGLCX,Fidelity Advisor Global Balanced Fund
FGLGX,Fidelity Series Growth & Income Fund
FGLIX,Fidelity Advisor Global Balanced Fund
FGLLX,Fidelity Series Intrinsic Opportunities
FGLTX,Fidelity Advisor Global Balanced Fund
FGMNX,Fidelity GNMA Fund
FGOVX,Fidelity Government Income Fund
FGRCX,Fidelity Advisor Mega Cap Stock Fund
FGRIX,Fidelity Growth and Income Pt
FGRTX,Fidelity Mega Cap Stock Fund
FGTAX,Fidelity Advisor Mega Cap Stock Fund
FGTNX,Fidelity Advisor Global Equity Income Fd
FHCCX,Fidelity Advisor Series Vii Fidelity
FHCIX,Fidelity Advisor Health Care Fund Class
FHEAX,Fidelity Advisor Real Estate Fund Class
FHECX,Fidelity Advisor Real Estate Fund Class
FHEIX,Fidelity Advisor Real Estate Fund Class
FHETX,Fidelity Advisor Real Estate Fund Class
FHFAX,Fidelity Advisor Freedom 2055 Fd Cl A
FHFCX,Fidelity Advisor Freedom 2055 Fd Cl C
FHFIX,Fidelity Advisor Freedom 2055 Fund Class
FHFTX,Fidelity Advisor Freedom 2055 Fd Cl T
FHIAX,Fidelity Advisor High Income Cl A
FHIFX,Fidelity Focused High Income Fund
FHIGX,Fidelity Municipal Income Fund
FHITX,Fidelity Advisor High Income Cl T
FHJMX,Fidelity Advisor Europe Fund Class I
FHJTX,Fidelity Advisor Europe Fund Class C
FHJUX,Fidelity Advisor Europe Fund Class A
FHJVX,Fidelity Advisor Europe Fund Class T
FHKAX,Fidelity Advisor China Region Fund Class
FHKCX,Fidelity China Region
FHKIX,Fidelity Advisor China Region Fund Class
FHKTX,Fidelity Advisor China Region Fund Class
FHNCX,Fidelity Advisor High Income Cl C
FHNIX,Fidelity Advisor High Income Fund Class
FIADX,Fidelity Advisor International Discovery
FIAFX,Fidelity Advisor Freedom Income Fund
FIAGX,Fidelity Advisor International Growth
FIARX,Fidelity Advisor Income Replacement Fund
FIASX,Fidelity Advisor International Small Cap
FIATX,Fidelity Advisor Ser ViII Fidelity
FIBFX,Fidelity Series Investment Grade Bond
FICCX,Fidelity Advisor Canada Fund Class I
FICDX,Fidelity Canada Fund
FICNX,Fidelity Connecticut Municipal Incom
FICRX,Fidelity Advisor Income Replacement Fund
FICSX,Fidelity Advisor International Small Cap
FICVX,Fidelity Advisor Convertible Securities
FIDKX,Fidelity International Discovery Fund
FIDSX,Fidelity Select Financial Services
FIEMX,Fidelity Advisor Emerging Europe Middle
FIENX,Fidelity International Enhanced Index
FIEUX,Fidelity Europe Fund
FIFFX,Fidelity Advisor Freedom 2040 Fund Class
FIGCX,Fidelity Advisor International Growth
FIGFX,Fidelity International Growth Fund
FIGRX,Fidelity International Discovery
FIGSX,Fidelity Series International Growth
FIHFX,Fidelity Freedom Index 2035 Fd Cl K
FIIAX,Fidelity Advisor Mid Cap II Fund Class A
FIICX,Fidelity Advisor Mid Cap II Fund Class C
FIIIX,Fidelity Advisor International Growth
FIIMX,Fidelity Advisor Mid Cap II Fund Class I
FIIRX,Fidelity Advisor Income Replacement 2032
FIIVX,Fidelity Advisor Income Replacement 2038
FIIWX,Fidelity Advisor Income Replacement 2040
FIKFX,Fidelity Freedom Index Income Fund Cl K
FILAX,Fidelity Advisor Income Replacement Fund
FILCX,Fidelity Advisor Income Replacement Fund
FILIX,Fidelity Advisor Income Replacement 2020
FILTX,Fidelity Advisor Income Replacement Fund
FIMIX,Fidelity Minnesota Municipal Income Fund
FIMKX,Fidelity Advisor Emerging Markets Fund
FINOX,Fidelity Advisor International Bond Fund
FINPX,Fidelity Inflation Protected Bond
FINRX,Fidelity Advisor International Bond Fund
FINSX,Fidelity Advisor New Insights Fund Class
FINTX,Fidelity Advisor International Bond Fund
FINUX,Fidelity International Bond Fund Retail
FINVX,Fidelity Series International Value Fund
FINWX,Fidelity Advisor International Bond Fund
FIOAX,Fidelity Advisor Income Replacement Fund
FIOCX,Fidelity Advisor Income Replacement Fund
FIOFX,Fidelity Freedom Index 2045 Fd Cl K
FIOIX,Fidelity Advisor Income Replacement 2026
FIONX,Fidelity Sai International Index Fund
FIOOX,Fidelity Series 1000 Value Index Fund
FIOTX,Fidelity Advisor Income Replacement Fund
FIPAX,Fidelity Advisor Inflation Protected
FIPCX,Fidelity Advisor Inflation Protected
FIPFX,Fidelity Freedom Index 2050 Fd Cl K
FIPIX,Fidelity Advisor Inflation-Protected
FIPTX,Fidelity Advisor Inflation Protected
FIRAX,Fidelity Advisor International Real
FIRCX,Fidelity Advisor International Real
FIREX,Fidelity International Real Estate Fund
FIRFX,Fidelity Advisor Income Replacement 2042
FIRIX,Fidelity Advisor International Real
FIRJX,Fidelity Income Replacement Fund 2016
FIRKX,Fidelity Income Replacement Fund 2018
FIRLX,Fidelity Income Replacement Fund 2020
FIRMX,Fidelity Income Replacement Fund 2022
FIRNX,Fidelity Income Replacement Fund 2024
FIROX,Fidelity Income Replacement Fund 2026
FIRPX,Fidelity Income Replacement Fund 2028
FIRQX,Fidelity Income Replacement Fund 2030
FIRRX,Fidelity Income Replacement Fund 2032
FIRSX,Fidelity Income Replacement Fund 2034
FIRTX,Fidelity Advisor International Real
FIRUX,Fidelity Income Replacement Fund 2036
FIRVX,Fidelity Income Replacement 2038 Fund
FIRWX,Fidelity Income Replacement 2040 Fund
FISHX,Fidelity Advisor Limited Term Municipal
FISMX,Fidelity International Small Cap
FITGX,Fidelity Advisor International Growth
FITHX,Fidelity Advisor Freedom 2035 Fund Class
FITIX,Fidelity Advisor Mid Cap II Fund Class T
FITTX,Fidelity Advisor Income Replacement 2042
FITWX,Fidelity Advisor Freedom 2025 Fund Class
FIUIX,Fidelity Utilities Fund
FIVFX,Fidelity Aggressive International Fund
FIVLX,Fidelity International Value Fund
FIVMX,Fidelity Advisor International Value
FIVOX,Fidelity Advisor International Value
FIVPX,Fidelity Advisor International Value
FIVQX,Fidelity Advisor International Value
FIWFX,Fidelity Freedom Index 2015 Fund Class W
FIWTX,Fidelity Freedom Index 2020 Fund Class W
FIXIX,Fidelity Advisor International Small Cap
FIXRX,Fidelity Income Replacement 2042 Fund
FJACX,Fidelity Series Small Cap Discovery Fund
FJAKX,Fidelity Series Small Cap Discovery Fund
FJIFX,Fidelity Freedom Index 2005 Fd Cl K
FJPCX,Fidelity Advisor Japan Fund Class C
FJPDX,Fidelity Advisor Event Driven
FJPIX,Fidelity Advisor Japan Fund Class I
FJPNX,Fidelity Japan Fund
FJPTX,Fidelity Advisor Japan Fund Class T
FJRLX,Fidelity Limited Term Bond Fund
FJSCX,Fidelity Japan Small Companies Fund
FKEMX,Fidelity Emerging Markets Fund Class K
FKIFX,Fidelity Freedom Index 2010 Fd Cl K
FKMCX,Fidelity Mid-Cap Stock Fund Class K
FKTHX,Fidelity Freedom K 2035 Fund
FKTWX,Fidelity Freedom K 2025 Fund
FKVFX,Fidelity Freedom K 2015 Fund
FLACX,Fidelity Advisor Stock Selector All Cap
FLATX,Fidelity Latin America Fund
FLCCX,Fidelity Advisor Series I Fidelity
FLCDX,Fidelity Large Cap Value Index
FLCEX,Fidelity Large Cap Core Enhanced Index
FLCHX,Fidelity Large Cap Value Index
FLCKX,Fidelity Leveraged Company Stock Fund
FLCMX,Fidelity Large Cap Value Index
FLCOX,Fidelity Large Cap Value Index
FLCPX,Fidelity Sai U.S. Large Cap Index Fund
FLCSX,Fidelity Large Cap Stock Fund
FLFAX,Fidelity Advisor Latin America Fund Cl A
FLFCX,Fidelity Advisor Latin America Fund Cl C
FLFIX,Fidelity Advisor Latin America Fund
FLFTX,Fidelity Advisor Latin America Fund Cl T
FLGEX,Fidelity Large Cap Growth Enhanced Index
FLIFX,Fidelity Freedom Index 2015 Fd Cl K
FLMLX,Fidelity Advisor Series Equity Income
FLPKX,Fidelity Low-Priced Stock Fund Class K
FLPSX,Fidelity Low-Priced Stock Fund
FLSAX,Fidelity Advisor Leveraged Company Stock
FLSCX,Fidelity Advisor Leveraged Company Stock
FLSTX,Fidelity Advisor Leveraged Company Stock
FLTMX,Fidelity Intermediate Municipal Income
FLUAX,Fidelity Advisor Stock Selector Large
FLUEX,Fidelity Advisor Stock Selector Large
FLUIX,Fidelity Advisor Stock Selector Large
FLUTX,Fidelity Advisor Stock Selector Large
FLVCX,Fidelity Leveraged Company Stock Fd
FLVEX,Fidelity Large Cap Value Enhanced Index
FLVIX,Fidelity Advisor Leveraged Company Stock
FMAGX,Fidelity Magellan
FMALX,Fidelity Advisor Series Growth & Income
FMAMX,Fidelity Advisor Stock Selector All Cap
FMCAX,Fidelity Advisor Stock Selector Mid Cap
FMCCX,Fidelity Advisor Stock Selector Mid Cap
FMCDX,Fidelity Advisor Stock Selector Mid Cap
FMCEX,Fidelity Advisor Stock Selector Mid Cap
FMCFX,Fidelity Municipal Income 2019 Fund
FMCKX,Fidelity Advisor Emerging Markets Class
FMCSX,Fidelity Mid-Cap Stock Fund
FMEAX,Fidelity Advisor Emerging Europe Middle
FMEIX,Fidelity Mid Cap Enhanced Index Fund
FMFAX,Fidelity Advisor Materials Fund Class A
FMFCX,Fidelity Advisor Materials Fund Class C
FMFEX,Fidelity Advisor Materials Fund Class I
FMFMX,Fidelity Advisor Series Equity Growth
FMFTX,Fidelity Advisor Materials Fund Class T
FMGAX,Fidelity Advisor Mortgage Securities Cl
FMGKX,Fidelity Magellan Fund Class K
FMHTX,Fidelity Michigan Municipal Income Fund
FMIFX,Fidelity Municipal Income 2017 Fund
FMILX,Fidelity New Millennium Fund
FMKAX,Fidelity Advisor Emerging Markets Income
FMKCX,Fidelity Advisor Emerging Markets Income
FMKIX,Fidelity Advisor Emerging Markets Income
FMMLX,Fidelity Advisor Series Stock Selector
FMNDX,Fidelity Conservative Income Municipal
FMPAX,Fidelity Advisor Mid Cap Value Fund
FMPEX,Fidelity Advisor Mid Cap Value Fund
FMPIX,Fidelity Advisor Municipal Income Fund
FMPOX,Fidelity Advisor Mid Cap Value Fund
FMPTX,Fidelity Advisor Mid Cap Value Fund
FMRMX,Fidelity Advisor Event Driven
FMSAX,Fidelity Income Fund Fidelity Advisor
