Code,Name
FMSCX,Fidelity Advisor Mortgage Securities
FMSFX,Fidelity Mortgage Securities Fund
FNARX,Fidelity Select Portfolio Natural
FNBCX,Fidelity Advisor Limited Term Bond Fund
FNCMX,Fidelity Nasdaq Composite Index
FNIAX,Fidelity Advisor New Insights Class A
FNICX,Fidelity Advisor New Insights Class C
FNITX,Fidelity Advisor New Insights Class T
FNJHX,Fidelity New Jersey Municipal Income
FNKLX,Fidelity Advisor Series Equity Income
FNMAX,Fidelity Advisor New York Municipal
FNMIX,Fidelity New Markets Income Fund
FNORX,Fidelity Investment Trust Fidelity
FNRCX,Fidelity Advisor Energy Class C
FNYCX,Fidelity Advisor New York Municipal
FNYPX,Fidelity Advisor New York Municipal
FOCFX,Fidelity Municipal Income 2021 Fund
FOCKX,Fidelity OTC Portfolio Class K
FOCPX,Fidelity OTC Pt
FOHFX,Fidelity Ohio Municipal Income Fund
FOHIX,Fidelity Series 100 Index Fund
FOHJX,Fidelity Series 100 Index Fund Class F
FOMAX,Fidelity Advisor Municipal Income 2021
FOMCX,Fidelity Advisor Mortgage Securities Cl
FOMIX,Fidelity Advisor Municipal Income 2021
FOPAX,Fidelity Advisor International Small Cap
FOPCX,Fidelity Advisor International Small Cap
FOPIX,Fidelity Advisor International Small Cap
FOPTX,Fidelity Advisor International Small Cap
FOSFX,Fidelity Overseas Fund
FOSKX,Fidelity Overseas Fund Class K
FPBFX,Fidelity Pacific-Basin Fund
FPHAX,Fidelity Select Pharmaceuticals
FPIFX,Fidelity Freedom Index 2020 Fd Cl K
FPJAX,Fidelity Advisor Japan Fund Class A
FPUKX,Fidelity Puritan Fund Class K
FPURX,Fidelity Puritan Fund
FPXTX,Fidelity Pennsylvania Municipal Income
FQIFX,Fidelity Freedom Index 2025 Fd Cl K
FRAMX,Fidelity Advisor Income Replacement Fund
FRAPX,Fidelity Advisor Income Replacement 2028
FRASX,Fidelity Advisor Income Replacement 2034
FRCMX,Fidelity Advisor Income Replacement Fund
FREDX,Fidelity Series Real Estate Equity Fd
FREFX,Fidelity Series Real Estate Fd Cl F
FRESX,Fidelity Real Estate Pt
FRGEX,Fidelity Series Stock Selector Large Cap
FRIFX,Fidelity Real Estate Income
FRIMX,Fidelity Advisor Income Replacement 2022
FRINX,Fidelity Advisor Real Estate Income Fund
FRIOX,Fidelity Advisor Real Estate Income Fund
FRIQX,Fidelity Advisor Real Estate Income Fund
FRIRX,Fidelity Advisor Real Estate Income Fund
FRJAX,Fidelity Advisor Income Replacement Fund
FRJCX,Fidelity Advisor Income Replacement Fund
FRJIX,Fidelity Advisor Income Replacement 2016
FRJTX,Fidelity Advisor Income Replacement Fund
FRKAX,Fidelity Advisor Income Replacement Fund
FRKCX,Fidelity Advisor Income Replacement Fund
FRKIX,Fidelity Advisor Income Replacement 2018
FRKTX,Fidelity Advisor Income Replacement Fund
FRLLX,Fidelity Series Equity Income Fund Class
FRNAX,Fidelity Advisor Income Replacement Fund
FRNCX,Fidelity Advisor Income Replacement Fund
FRNIX,Fidelity Advisor Income Replacement 2024
FRNTX,Fidelity Advisor Income Replacement Fund
FRQAX,Fidelity Advisor Income Replacement Fund
FRQCX,Fidelity Advisor Income Replacement Fund
FRQIX,Fidelity Advisor Income Replacement 2030
FRQTX,Fidelity Advisor Income Replacement Fund
FRTMX,Fidelity Advisor Income Replacement Fund
FSAAX,Fidelity Advisor Asset Manager 60% Class
FSAEX,Fidelity Series All Sector Equity Fund
FSAGX,Fidelity Select Gold Pt
FSAHX,Fidelity Short Duration High Income Fund
FSAIX,Fidelity Select Air Transportation Pt
FSAMX,Fidelity Strategic Advisors Emerging
FSANX,Fidelity Asset Manager 60%
FSATX,Fidelity Advisor Asset Manager 60% Class
FSAVX,Fidelity Select Automotive Portfolio
FSAZX,Fidelity Arizona Municipal Income Fund
FSBDX,Fidelity Series Blue Chip Growth Fund
FSBEX,Fidelity Series Blue Chip Growth Fund
FSBHX,Fidelity Advisor Short Duration High
FSCDX,Fidelity Advisor Series I Fidelity
FSCEX,Fidelity Advisor Series I Fidelity
FSCGX,Fidelity Select Industrial Equipment
FSCHX,Fidelity Select Chemical Pt
FSCIX,Fidelity Advisor Small Cap Fund Class I
FSCKX,Spartan Mid Cap Index Fd Fidelity Advg
FSCNX,Fidelity Advisor Asset Manager 60% Class
FSCOX,Fidelity International Small Cap
FSCPX,Fidelity Select Consumer Discretionary
FSCRX,Fidelity Small Cap Discovery Fund
FSCTX,Fidelity Advisor Series I Fidelity
FSDAX,Fidelity Select Defense & Aerospace
FSDCX,Fidelity Select Communications Equipment
FSDHX,Fidelity Advisor Short Duration High
FSDIX,Fidelity Strategic Dividend & Income
FSDPX,Fidelity Select Materials Portfolio
FSEAX,Fidelity Emerging Asia Fund
FSEHX,Fidelity Advisor Short Duration High
FSELX,Fidelity Select Electronics Pt
FSENX,Fidelity Select Energy
FSESX,Fidelity Select Energy Services Pt
FSFFX,Fidelity Series All-Sector Equity Fund
FSFHX,Fidelity Advisor Short Duration High
FSGDX,Spartan Global Ex US Index Fd Fidelity
FSGEX,Fidelity Series Global Ex U.S. Index
FSGGX,Spartan Global Ex US Index Fd Fidelity
FSHBX,Fidelity Short Term Bond Fund
FSHFX,Fidelity Series High Income Fd Cl F
FSHNX,Fidelity Series High Income Fd
FSHOX,Fidelity Select Construction and Housing
FSIAX,Fidelity Advisor Stratigic Income T
FSICX,Fidelity School Street Trust Fidelity
FSIDX,Fidelity Advisor Strategic Dividend &
FSIGX,Fidelity Series Investment Grade Bond
FSIOX,Fidelity Series 1000 Value Index Fund
FSIPX,Fidelity Series Inflation-Protected Bond
FSIRX,Fidelity Advisor Strategic Real Return
FSITX,Spartan U.S. Bond Index Fd Fidelity
FSJHX,Fidelity Advisor Stock Selector All Cap
FSKAX,Spartan Total Market Index Fd Fidelity
FSKLX,Fidelity Sai International Minimum
FSLBX,Fidelity Select Brokerage & Investment
FSLCX,Fidelity Commonwealth Trust Fidelity
FSLEX,Fidelity Select Environmental and
FSLSX,Fidelity Value Strategies Fund
FSLVX,Fidelity Stock Selector Large Cap Value
FSMDX,Spartan Mid Cap Index Fd Fidelity Advg
FSMEX,Fidelity Select Portfolio Medical
FSMVX,Fidelity Mid Cap Value Fund
FSNGX,Fidelity Select Natural Gas Portfolio
FSNIX,Fidelity Advisor Asset Manager 60% Class
FSOAX,Fidelity Advisor Value Strategies Cl A
FSODX,Fidelity Advisor Municipal Income 2023
FSOFX,Fidelity Series Small Cap Opportunities
FSOPX,Fidelity Series Small Cap Opportunities
FSPCX,Fidelity Select Insurance Portfolio
FSPGX,Fidelity Large Cap Growth Index
FSPHX,Fidelity Select Health Care
FSPSX,Spartan International Index Fd Fidelity
FSPTX,Fidelity Select Technology
FSRAX,Fidelity Advisor Strategic Real Return
FSRBX,Fidelity Select Banking Portfolio
FSRCX,Fidelity Advisor Series II Fidelity
FSREX,Fidelity Series Real Estate Income Fd
FSRFX,Fidelity Select Transportation Portfolio
FSRIX,Fidelity Advisor Strategic Income Fund
FSRPX,Fidelity Select Retailing Pt
FSRRX,Fidelity Strategic Real Return Fund
FSRTX,Fidelity Advisor Strategic Real Return
FSRVX,Spartan Real Estate Index Fd Fidelity
FSRWX,Fidelity Series Real Estate Income Fd Cl
FSSFX,Fidelity Advisor Series Small Cap Fund
FSSKX,Fidelity Stock Selector All Cap Class K
FSSMX,Fidelity Stock Sector Mid Cap Fund
FSSNX,Spartan Small Cap Index Fd Fidelity Advg
FSSVX,Spartan Small Cap Index Fd Fidelity Advg
FSTAX,Fidelity Advisor Series II Fidelity
FSTCX,Fidelity Select Telecommunications Pt
FSTFX,Fidelity Limited Term Municipal Income
FSTGX,Fidelity Intermediate Government Income
FSTSX,Fidelity Series International Small Cap
FSTVX,Spartan Total Market Index Fund Fidelity
FSUIX,Fidelity Large Cap Growth Index
FSUPX,Fidelity Large Cap Growth Index
FSUTX,Fidelity Select Utilities Growth
FSUVX,Fidelity Sai U.S. Minimum Volatility
FSVLX,Fidelity Select Consumer Finance
FSWIX,Fidelity Large Cap Growth Index
FSWTX,Fidelity Advisor Municipal Income 2023
FTAAX,Fidelity Advisor Asset Manager 30% Class
FTABX,Fidelity Tax-Free Bond Fund
FTADX,Fidelity Advisor International Discovery
FTAEX,Fidelity Advisor Total International
FTAFX,Fidelity Advisor Freedom Income Cl T
FTANX,Fidelity Asset Manager 30%
FTASX,Fidelity Advisor Asset Manager 70% Class
FTAWX,Fidelity Advisor Asset Manager 20% Class
FTBFX,Fidelity Total Bond
FTBRX,Fidelity Advisor Limited Term Bond Fund
FTBTX,Fidelity Series Growth & Income Fund Cl
FTCEX,Fidelity Advisor Total International
FTCNX,Fidelity Advisor Canada Fund Class T
FTCVX,Fidelity Advisor Convertible Securities
FTCWX,Fidelity Advisor Asset Manager 20% Class
FTDWX,Fidelity Advisor Asset Manager 20% Class
FTEDX,Fidelity Advisor Total Emerging Markets
FTEFX,Fidelity Advisor Total Emerging Markets
FTEHX,Fidelity Advisor Total Emerging Markets
FTEIX,Fidelity Advisor Total International
FTEJX,Fidelity Advisor Total Emerging Markets
FTEMX,Fidelity Total Emerging Markets Fd
FTFEX,Fidelity Advisor Freedom 2030 Cl T
FTFFX,Fidelity Advisor Freedom 2040 Cl T
FTFMX,Fidelity New York Municipal Income Fund
FTGRX,Fidelity Advisor Mega Cap Stock Fund
FTHCX,Fidelity Advisor Series Vii Fidelity
FTHRX,Fidelity Intermediate Bond Fund
FTIEX,Fidelity Total International Equity Fund
FTIGX,Fidelity Total International In
FTIHX,Fidelity Total International In
FTINX,Fidelity Advisor Asset Manager 30% Class
FTIPX,Fidelity Total International In
FTIRX,Fidelity Advisor Income Replacement Fund
FTISX,Fidelity Advisor International Small Cap
FTIUX,Fidelity Total International In
FTIWX,Fidelity Advisor Asset Manager 20% Class
FTLTX,Fidelity Series Long-Term Treas
FTMKX,Fidelity Advisor Emerging Markets Class
FTQGX,Fidelity Capital Trust Fidelity Focused
FTRIX,Fidelity Advisor Mega Cap Stock Fund
FTRNX,Fidelity Trend Fund
FTRPX,Fidelity Advisor Income Replacement Fund
FTRSX,Fidelity Advisor Income Replacement Fund
FTRVX,Fidelity Advisor Income Replacement 2038
FTRWX,Fidelity Advisor Income Replacement 2040
FTSDX,Fidelity Advisor Strategic Dividend &
FTSHX,Fidelity Advisor Limited Term Municipal
FTTEX,Fidelity Advisor Total International
FTTHX,Fidelity Advisor Freedom 2035 Cl T
FTTNX,Fidelity Advisor Asset Manager 30% Class
FTTWX,Fidelity Advisor Freedom 2025 Cl T
FTUAX,Fidelity Advisor Telecommunications Fund
FTUCX,Fidelity Advisor Telecommunications Fund
FTUIX,Fidelity Advisor Telecommunications Fund
FTUTX,Fidelity Advisor Telecommunications Fund
FTVFX,Fidelity Advisor Value Class T
FUGAX,Fidelity Advisor Utilities Cl A
FUGCX,Fidelity Advisor Utilities Cl C
FUGIX,Fidelity Advisor Utilities Fund Class I
FUQIX,Fidelity Sai U.S. Quality Index Fund
FURAX,Fidelity Advisor Income Replacement Fund
FURCX,Fidelity Advisor Income Replacement Fund
FURIX,Fidelity Advisor Income Replacement 2036
FURTX,Fidelity Advisor Income Replacement Fund
FUTBX,Fidelity Sai U.S. Treasury Bond Index
FVCSX,Fidelity Advisor Value Strategies Cl C
FVDFX,Fidelity Value Discovery
FVDKX,Fidelity Value Discovery Fund Class K
FVIAX,Fidelity Advisor Government Income Class
FVICX,Fidelity Advisor Government Income Class
FVIFX,Fidelity Advisor Value Fund Class I
FVIIX,Fidelity Advisor Government Income Fund
FVITX,Fidelity Advisor Government Income Class
FVLAX,Fidelity Advisor Value Leaders Class A
FVLCX,Fidelity Advisor Value Leaders Class C
FVLIX,Fidelity Advisor Value Leaders Fund
FVLKX,Fidelity Value Fund Class K
FVLTX,Fidelity Advisor Value Leaders Class T
FVSKX,Fidelity Value Strategies Fund Class K
FVWSX,Fidelity Series Opportunistic Insights
FWAFX,Fidelity Advisor Worldwide Fund Class A
FWATX,Fidelity Advisor Multi-Asset Income Fund
FWBTX,Fidelity Advisor Multi-Asset Income Fund
FWCFX,Fidelity Advisor Worldwide Fund Class C
FWIFX,Fidelity Advisor Worldwide Fund Class I
FWRAX,Fidelity Advisor Global Real Estate Fund
FWRCX,Fidelity Advisor Global Real Estate Fund
FWRIX,Fidelity Advisor Global Real Estate Fund
FWRLX,Fidelity Select Wireless
FWRTX,Fidelity Advisor Global Real Estate Fund
FWTFX,Fidelity Advisor Worldwide Fund Class T
FWWEX,Fidelity Series Opportunistic Insights
FWWFX,Fidelity Worldwide Fund
FXIFX,Fidelity Freedom Index 2030 Fd Cl K
FXNAX,Spartan U.S. Bond Index Fd Fidelity
FYATX,Fidelity Advisor Series Short-Term
FYBTX,Fidelity Series Short-Term Credit Fund
FYCTX,Fidelity Series Short-Term Credit Fund
FZAAX,Fidelity Advisor Balanced Fd Cl Z
FZABX,Fidelity Advisor Diversified
FZACX,Fidelity Advisor Diversified Stock Fd Cl
FZADX,Fidelity Advisor Dividend Growth Fd Cl Z
FZAEX,Fidelity Advisor Emerging Markets Fd Cl
FZAFX,Fidelity Advisor Equity Growth Fd Cl Z
FZAGX,Fidelity Advisor Equity Income Fd Cl Z
FZAHX,Fidelity Advisor Growth Opportunities Fd
FZAIX,Fidelity Advisor International Discovery
FZAJX,Fidelity Advisor International Growth Fd
FZAKX,Fidelity Advisor Leveraged Company Stock
FZALX,Fidelity Advisor Mega Cap Stock Fd Cl Z
FZAMX,Fidelity Advisor Mid Cap II Fd Cl Z
FZANX,Fidelity Advisor New Insights Fd Cl Z
FZAOX,Fidelity Advisor Small Cap Fd Cl Z
FZAPX,Fidelity Advisor Stock Selector All Cap
FZFLX,Fidelity Sai Small-Mid Cap 500 Index
FZIAX,Fidelity Advisor Intermediate Municipal
FZICX,Fidelity Advisor Intermediate Municipal
FZIIX,Fidelity Advisor Intermediate Municipal
FZITX,Fidelity Advisor Intermediate Municipal
